{
  "$schema": "http://json-schema.org/draft-07/schema#",
  "$id": "https://globalperspective.net/schema/record-fact.json",
  "title": "Fact (one line of record/facts/YYYY-MM-DD.jsonl), decision 0036 section 2",
  "type": "object",
  "required": ["schemaVersion", "eventId", "kind", "at", "date", "precision", "threadId", "iso3", "actorIds", "sourceIds", "payload", "producer", "sourceKey", "sourceRow"],
  "properties": {
    "schemaVersion": { "const": 1 },
    "eventId": { "type": "string", "pattern": "^[0-9a-f]{40}$" },
    "kind": { "enum": ["entry", "story_born", "forecast_drawn", "verdict", "correction", "story_merged", "run"] },
    "at": { "type": "string", "format": "date-time", "pattern": "^\\d{4}-\\d{2}-\\d{2}T[0-9:.]+Z$" },
    "date": { "type": "string", "pattern": "^\\d{4}-\\d{2}-\\d{2}$" },
    "precision": { "enum": ["exact", "day"] },
    "threadId": { "type": ["string", "null"] },
    "iso3": { "type": "array", "items": { "type": "string", "pattern": "^[A-Z]{3}$" }, "uniqueItems": true },
    "actorIds": { "type": "array", "items": { "type": "string", "pattern": "^name:.+" }, "uniqueItems": true },
    "sourceIds": { "type": "array", "items": { "type": "string", "pattern": "^[0-9a-f]{40}$" }, "uniqueItems": true },
    "payload": { "type": "object" },
    "producer": {
      "type": "object",
      "required": ["lambda", "runId"],
      "properties": { "lambda": { "type": "string", "pattern": "^newsStoryRecord@" }, "runId": { "type": "string", "pattern": "^\\d{4}-\\d{2}-\\d{2}-\\d+$" } },
      "additionalProperties": false
    },
    "sourceKey": { "type": "string", "minLength": 1 },
    "sourceRow": {
      "type": "object",
      "required": ["store", "key"],
      "properties": { "store": { "type": "string" }, "key": { "type": ["object", "string"] }, "index": { "type": "integer", "minimum": 0 } }
    },
    "idBasis": { "enum": ["url", "title"] },
    "sources": {
      "type": "array",
      "items": {
        "type": "object",
        "required": ["sourceId", "outlet", "url", "title"],
        "properties": {
          "sourceId": { "type": ["string", "null"], "pattern": "^[0-9a-f]{40}$" },
          "outlet": { "type": ["string", "null"] },
          "url": { "type": ["string", "null"] },
          "title": { "type": ["string", "null"] }
        },
        "additionalProperties": false
      }
    }
  },
  "allOf": [
    {
      "if": { "properties": { "kind": { "const": "entry" } } },
      "then": {
        "required": ["idBasis", "sources"],
        "properties": {
          "payload": {
            "required": ["title", "summary", "category", "eventType", "continuesTopic", "topicId"],
            "properties": { "title": { "type": "string" }, "summary": { "type": ["string", "null"] }, "category": { "type": ["string", "null"] }, "eventType": { "type": ["string", "null"] }, "continuesTopic": { "type": ["string", "null"] }, "topicId": { "type": "string" } }
          }
        }
      }
    },
    {
      "if": { "properties": { "kind": { "const": "story_born" } } },
      "then": {
        "properties": {
          "threadId": { "type": "string" },
          "payload": {
            "required": ["born", "bornAtApprox", "firstTitle", "windowLimited", "missingBefore"],
            "properties": { "born": { "type": "string" }, "bornAtApprox": { "type": "boolean" }, "firstTitle": { "type": "string" }, "windowLimited": { "type": "boolean" }, "missingBefore": { "type": "array", "items": { "type": "string" } } }
          }
        }
      }
    },
    {
      "if": { "properties": { "kind": { "const": "forecast_drawn" } } },
      "then": {
        "properties": {
          "threadId": { "type": "string" },
          "payload": {
            "required": ["forkId", "branches"],
            "properties": {
              "forkId": { "type": "string" },
              "branches": {
                "type": "array",
                "items": {
                  "type": "object",
                  "required": ["branchId", "text", "p", "trigger", "resolutionSource", "due"],
                  "properties": { "branchId": { "type": "string" }, "text": { "type": "string" }, "p": { "type": ["number", "null"] }, "trigger": { "type": "string" }, "resolutionSource": { "type": "string" }, "due": { "type": ["string", "null"] } }
                }
              }
            }
          }
        }
      }
    },
    {
      "if": { "properties": { "kind": { "const": "verdict" } } },
      "then": {
        "properties": {
          "threadId": { "type": "string" },
          "payload": {
            "required": ["qid", "result", "decidedBy", "evidence"],
            "properties": { "qid": { "type": "string" }, "result": { "enum": ["yes", "no", "void"] }, "decidedBy": { "type": ["string", "null"] } }
          }
        }
      }
    },
    {
      "if": { "properties": { "kind": { "const": "correction" } } },
      "then": {
        "properties": {
          "payload": {
            "required": ["corrects", "what", "reason"],
            "properties": { "corrects": { "type": "string", "pattern": "^[0-9a-f]{40}$" }, "what": { "type": "string", "minLength": 1 }, "reason": { "type": "string", "minLength": 1 } }
          }
        }
      }
    },
    {
      "if": { "properties": { "kind": { "const": "story_merged" } } },
      "then": {
        "properties": {
          "threadId": { "type": "string" },
          "payload": {
            "required": ["from", "into", "reason", "evidence"],
            "properties": { "from": { "type": "string" }, "into": { "type": "string" }, "reason": { "type": "string", "minLength": 1 }, "evidence": { "type": "array" } }
          }
        }
      }
    },
    {
      "if": { "properties": { "kind": { "const": "run" } } },
      "then": {
        "properties": {
          "threadId": { "type": "null" },
          "payload": {
            "required": ["runId", "status", "counts"],
            "properties": { "runId": { "type": "string" }, "status": { "enum": ["ok", "partial", "failed"] }, "counts": { "type": "object" } }
          }
        }
      }
    }
  ]
}
